<?xml version="1.0" encoding="utf-8"?>
<Content xmlns:xsi="http://www.w3.org/2001/XMLSchema-instance"
         xmlns="http://tempuri.org/Language.xsd"
         xsi:schemaLocation="http://tempuri.org/Language.xsd Language.xsd">

	<Buttons>
		<Ok>Ok</Ok>
		<JoinGame>Join</JoinGame>
		<SinglePlayer>Singleplayer</SinglePlayer>
    <Play>Play</Play>
		<Settings>Settings</Settings>
		<WatchReplay>Watch replay</WatchReplay>
		<Exit>Exit</Exit>
		<Back>Back</Back>
		<Close>Close</Close>
		<Leave>Leave</Leave>
		<LeaveMatch>Leave match</LeaveMatch>
		<Stay>Stay</Stay>
		<Continue>Continue</Continue>
		<Menu>Menu</Menu>
	</Buttons>

	<Labels>
		<Language>Language</Language>
		<Resolution>Resolution</Resolution>
		<DisplayMode>Display mode</DisplayMode>
		<DisplayModeWindowed>Windowed</DisplayModeWindowed>
		<DisplayModeFullScreen>Fullscreen</DisplayModeFullScreen>
		<DisplayModeBorderless>Borderless</DisplayModeBorderless>
		<JoinRoom>Join room</JoinRoom>
		<Nickname>Nickname</Nickname>
		<TeamName>Team name</TeamName>
		<TankType>Tank type</TankType>
		<Difficulty>Difficulty</Difficulty>
		<RoomCode>Room code</RoomCode>
		<ServerAddress>Server address</ServerAddress>
	</Labels>

	<MessageBoxLabels>
		<ErrorOccurred>Oh no! An error occurred!</ErrorOccurred>
		<ConnectionFailed>Connection failed</ConnectionFailed>
		<ConnectionRejected>Connection rejected</ConnectionRejected>
	</MessageBoxLabels>
	
	<ConnectionRejectedReason>
		<InvalidJoinCode>Invalid join code!</InvalidJoinCode>
		<MissingNickname>Nickname is required!</MissingNickname>
		<MissingTeamName>Team name is required!</MissingTeamName>
		<InvalidTankType>Invalid tank type!</InvalidTankType>
		<NicknameExists>Nickname already exists!</NicknameExists>
		<InvalidUrlPath>Invalid URL path!</InvalidUrlPath>
		<GameFull>Game is full!</GameFull>
		<GameInProgress>Game is in progress!</GameInProgress>
		<TeamFull>Team is full!</TeamFull>
		<TankTypeTaken>Tank type is already taken!</TankTypeTaken>
		<TooManyFailedAttempts>Too many failed attempts! Try again later.</TooManyFailedAttempts>
	</ConnectionRejectedReason>

	<ConfirmQuestion>
		<LeaveMatch>Are you sure you want to leave the match?</LeaveMatch>
	</ConfirmQuestion>

	<Other>
		<Light>Light</Light>
		<Heavy>Heavy</Heavy>
		<Easy>Easy</Easy>
		<Medium>Medium</Medium>
		<Hard>Hard</Hard>
		<Loading>Loading</Loading>
		<Waiting>Waiting</Waiting>
		<Connecting>Connecting</Connecting>
		<NoDetails>No details.</NoDetails>
		<ServerNotResponding>Server is not responding.</ServerNotResponding>
	</Other>

</Content>