<?xml version="1.0" encoding="utf-8"?>
<Content xmlns:xsi="http://www.w3.org/2001/XMLSchema-instance"
         xmlns="http://tempuri.org/Language.xsd"
         xsi:schemaLocation="http://tempuri.org/Language.xsd Language.xsd">

	<Buttons>
		<Ok>Ok</Ok>
		<JoinGame>Rejoindre</JoinGame>
		<SinglePlayer>Solo</SinglePlayer>
		<Settings>Paramètres</Settings>
		<WatchReplay>Rediffusions</WatchReplay>
		<Exit>Quitter</Exit>
		<Back>Retour</Back>
		<Close>Fermer</Close>
		<Leave>Quitter</Leave>
		<LeaveMatch>Quitter le match</LeaveMatch>
		<Stay>Rester</Stay>
		<Continue>Continuer</Continue>
		<Menu>Menu</Menu>
	</Buttons>

	<Labels>
		<Language>Langue</Language>
		<Resolution>Résolution d'écran</Resolution>
		<DisplayMode>Mode d'affichage</DisplayMode>
		<DisplayModeWindowed>Fenêtré</DisplayModeWindowed>
		<DisplayModeFullScreen>Plein écran</DisplayModeFullScreen>
		<DisplayModeBorderless>Sans bordure</DisplayModeBorderless>
		<JoinRoom>Rejoindre une salle</JoinRoom>
		<Nickname>Surnom</Nickname>
		<TeamName>Nom de l'équipe</TeamName>
		<TankType>Type de char</TankType>
		<RoomCode>Code de la salle</RoomCode>
		<ServerAddress>Adresse du serveur</ServerAddress>
	</Labels>
	
	<MessageBoxLabels>
		<ErrorOccurred>Oh non, une erreur est survenue!</ErrorOccurred>
		<ConnectionFailed>Échec de la connexion</ConnectionFailed>
		<ConnectionRejected>Connexion rejetée</ConnectionRejected>
	</MessageBoxLabels>
	
	<ConnectionRejectedReason>
		<InvalidJoinCode>Le code de connexion est invalide!</InvalidJoinCode>
		<MissingNickname>Le surnom est requis!</MissingNickname>
		<MissingTeamName>Le nom de l'équipe est requis!</MissingTeamName>
		<InvalidTankType>Type de char invalide!</InvalidTankType>
		<NicknameExists>Ce surnom est déjà utilisé!</NicknameExists>
		<InvalidUrlPath>Chemin d'URL invalide!</InvalidUrlPath>
		<GameFull>La salle est pleine!</GameFull>
		<GameInProgress>La partie est en cours!</GameInProgress>
		<TeamFull>L'équipe est pleine!</TeamFull>
		<TankTypeTaken>Type de char déjà pris!</TankTypeTaken>
		<TooManyFailedAttempts>Trop de tentatives échouées! Réessayez plus tard.</TooManyFailedAttempts>
	</ConnectionRejectedReason>
	
	<ConfirmQuestion>
		<LeaveMatch>Êtes-vous sûr de vouloir quitter le match?</LeaveMatch>
	</ConfirmQuestion>

	<Other>
		<Light>Léger</Light>
		<Heavy>Lourd</Heavy>
		<Loading>Chargement</Loading>
		<Waiting>En attente</Waiting>
		<Connecting>Connexion en cours</Connecting>
		<NoDetails>Aucun détail.</NoDetails>
		<ServerNotResponding>Le serveur ne répond pas.</ServerNotResponding>
	</Other>

</Content>
