<?xml version="1.0" encoding="utf-8"?>
<Content xmlns:xsi="http://www.w3.org/2001/XMLSchema-instance"
         xmlns="http://tempuri.org/Language.xsd"
         xsi:schemaLocation="http://tempuri.org/Language.xsd Language.xsd">

	<Buttons>
		<Ok>Ok</Ok>
		<JoinGame>Dołącz</JoinGame>
		<SinglePlayer>Gra dla jednego gracza</SinglePlayer>
		<Settings>Ustawienia</Settings>
		<WatchReplay>Powtórki</WatchReplay>
		<Exit>Wyjście</Exit>
		<Back>Wróć</Back>
		<Close>Zamknij</Close>
		<Leave>Opuść</Leave>
		<LeaveMatch>Opuść mecz</LeaveMatch>
		<Stay>Zostań</Stay>
		<Continue>Kontynuuj</Continue>
		<Menu>Menu</Menu>
	</Buttons>

	<Labels>
		<Language>Język</Language>
		<Resolution>Rozdzielczość</Resolution>
		<DisplayMode>Tryb wyświetlania</DisplayMode>
		<DisplayModeWindowed>Okienkowy</DisplayModeWindowed>
		<DisplayModeFullScreen>Pełny ekran</DisplayModeFullScreen>
		<DisplayModeBorderless>Bezramkowy</DisplayModeBorderless>
		<JoinRoom>Dołącz do pokoju</JoinRoom>
		<Nickname>Nazwa gracza</Nickname>
		<TeamName>Nazwa drużyny</TeamName>
		<TankType>Typ czołgu</TankType>
		<RoomCode>Kod pokoju</RoomCode>
		<ServerAddress>Adres serwera</ServerAddress>
	</Labels>
	
	<MessageBoxLabels>
		<ErrorOccurred>Ups, coś poszło nie tak!</ErrorOccurred>
		<ConnectionFailed>Połączenie nieudane</ConnectionFailed>
		<ConnectionRejected>Połączenie odrzucone</ConnectionRejected>
	</MessageBoxLabels>
	
	<ConnectionRejectedReason>
		<InvalidJoinCode>Nieprawidłowy kod dołączenia!</InvalidJoinCode>
		<MissingNickname>Nazwa gracza jest wymagana!</MissingNickname>
		<MissingTeamName>Nazwa drużyny jest wymagana!</MissingTeamName>
		<InvalidTankType>Nieprawidłowy typ czołgu!</InvalidTankType>
		<NicknameExists>Gracz o takiej nazwie już istnieje!</NicknameExists>
		<InvalidUrlPath>Nieprawidłowa ścieżka URL!</InvalidUrlPath>
		<GameFull>Pokój jest pełny!</GameFull>
		<GameInProgress>Gra już trwa!</GameInProgress>
		<TeamFull>Drużyna jest pełna!</TeamFull>
		<TankTypeTaken>Typ czołgu jest już zajęty!</TankTypeTaken>
		<TooManyFailedAttempts>Za dużo nieudanych prób! Spróbuj ponownie później.</TooManyFailedAttempts>
	</ConnectionRejectedReason>

	<ConfirmQuestion>
		<LeaveMatch>Czy na pewno chcesz opuścić mecz?</LeaveMatch>
	</ConfirmQuestion>

	<Other>
		<Light>Lekki</Light>
		<Heavy>Ciężki</Heavy>
		<Loading>Wczytywanie</Loading>
		<Waiting>Oczekiwanie</Waiting>
		<Connecting>Łączenie</Connecting>
		<NoDetails>Brak szczegółów.</NoDetails>
		<ServerNotResponding>Serwer nie odpowiada.</ServerNotResponding>
	</Other>
</Content>
